url,domain,title,language,category,topic_tags,author,published_date,last_checked,summary,authority_signal,paywall,notes
https://arxiv.org/html/2603.29979,arxiv.org,Structural Feature Engineering for Generative Engine Optimization,en,academic,geo;structure;citation,,2026,2026-05-08,Jak content structure ovlivnuje citation behavior,original-research,no,
https://arxiv.org/html/2604.25707,arxiv.org,From Citation Selection to Citation Absorption,en,academic,geo;measurement;citation,,2026,2026-05-08,Two-stage measurement framework pro GEO,original-research,no,
https://www.therankmasters.com/insights/ai-visibility/ai-citation-tools-url-level,therankmasters.com,Best AI Citation Tracking Tools (URL-Level) (2026),en,industry-blog,vendors;citation,The Rank Masters,2026,2026-05-08,,practitioner-howto,no,
https://www.therankmasters.com/insights/ai-visibility/best-ai-visibility-tools-citation-tracking,therankmasters.com,Best AI Citation Tracking Tools for AI Visibility (2026),en,industry-blog,vendors;citation,The Rank Masters,2026,2026-05-08,,practitioner-howto,no,
https://community.openai.com/t/chat-completions-api-with-web-citations/1057454,community.openai.com,Chat Completions API with Web Citations (community thread),en,community,openai;api;citations,,2025,2026-05-08,,community-discussion,no,
https://www.unusual.ai/blog/chatgpt-platform-guide-make-your-content-easy-to-cite-in-search-mode,unusual.ai,ChatGPT Platform Guide: Make Content Easy to Cite,en,industry-blog,chatgpt;citation,Unusual.ai,2025,2026-05-08,,vendor-marketing,no,
https://agenxus.com/blog/perplexity-playbook-citations-collections-sources-how-to,agenxus.com,The Perplexity Playbook: Citations Collections AI Search,en,industry-blog,perplexity;citation,Agenxus,2025,2026-05-08,,practitioner-howto,no,
https://www.ferventers.com/blogs/how-to-get-cited-in-perplexity,ferventers.com,How to Get Cited in Perplexity AI 2026,en,industry-blog,perplexity;citation,Ferventers,2026,2026-05-08,,practitioner-howto,no,
https://www.rankshift.ai/blog/how-to-get-cited-as-a-source-in-perplexity-ai/,rankshift.ai,How to Get Cited as a Source in Perplexity AI,en,industry-blog,perplexity;citation,Rankshift,2025,2026-05-08,,practitioner-howto,no,
https://amicitable.com/blog/perplexity-ai-citations,amicitable.com,How to Get Cited by Perplexity AI,en,industry-blog,perplexity;citation,Am I Citable,2025,2026-05-08,,practitioner-howto,no,
https://platform.claude.com/docs/en/build-with-claude/citations,platform.claude.com,Claude Citations API docs,en,platform-doc,anthropic;citations,Anthropic,2025,2026-05-08,,original-research,no,
https://claude.com/blog/introducing-citations-api,claude.com,Introducing Citations on the Anthropic API,en,platform-doc,anthropic;citations;launch,Anthropic,2025,2026-05-08,,original-research,no,
https://www.searchenginejournal.com/seo-pulse-chatgpt-gets-shopping-what-drives-ai-citations/562095/,searchenginejournal.com,SEO Pulse: ChatGPT Shopping AI Citations,en,industry-blog,chatgpt;shopping;citations,SEJ,2026,2026-05-08,,industry-leader,no,
https://www.adweek.com/media/youtube-reddit-ai-search-engine-citations/,adweek.com,YouTube Overtakes Reddit as AI Citation Source,en,news,youtube;reddit;citations,Adweek,2025,2026-05-08,,industry-leader,no,
https://searchengineland.com/youtube-ai-search-citations-data-462830,searchengineland.com,YouTube dominates AI search 200x citation,en,news,youtube;citations;data,SEL,2025,2026-05-08,,industry-leader,no,
https://www.anthropic.com/news/introducing-citations-api,anthropic.com,Introducing Citations on Anthropic API,en,platform-doc,anthropic;citations;launch,Anthropic,2025-01,2026-05-08,Oficiální launch,original-research,no,
https://techcrunch.com/2025/01/23/anthropics-new-citations-feature-aims-to-reduce-ai-errors/,techcrunch.com,Anthropic Citations feature reduce AI errors,en,news,anthropic;citations,TechCrunch,2025-01-23,2026-05-08,,industry-leader,no,
https://ppc.land/23-factors-that-actually-get-your-content-cited-by-ai-search-engines/,ppc.land,23 factors that get your content cited by AI search,en,news,citation;ranking-factors;data,PPC Land,2026-05,2026-05-08,Klíčový Cyrus Shepard meta-analysis,industry-leader,no,
https://everything-pr.com/94-of-ai-citations-come-from-earned-media-brand-blogs-are-invisible/,everything-pr.com,94% of AI Citations Come from Earned Media,en,industry-blog,citations;earned-media,Everything PR,2026,2026-05-08,,industry-leader,no,
https://thedigitalbloom.com/learn/ai-citation-position-revenue-report-2026/,thedigitalbloom.com,2026 AI Citation Position Revenue Report,en,industry-blog,citations;revenue;data,Digital Bloom,2026,2026-05-08,Klíčová data 23x conversion premium,industry-leader,no,
https://arxiv.org/html/2509.05741v1,arxiv.org,Enhancing Factual Accuracy and Citation Generation Multi-Stage Self-Verification,en,academic,citation;factual;verification,,2025-09,2026-05-08,,original-research,no,
https://arxiv.org/html/2512.09483v1,arxiv.org,Source Coverage and Citation Bias LLM vs Traditional Search,en,academic,bias;citation;llm-search,,2025-12,2026-05-08,Klíčový bias paper,original-research,no,
https://arxiv.org/abs/2512.09483,arxiv.org,Source Coverage Citation Bias abstract,en,academic,bias;citation,,2025-12,2026-05-08,,original-research,no,
https://arxiv.org/html/2507.05301v1,arxiv.org,News Source Citing Patterns AI Search Systems,en,academic,citation;news;ai-search,,2025-07,2026-05-08,,original-research,no,
https://arxiv.org/html/2405.15739v3,arxiv.org,LLMs Reflect Human Citation Patterns Heightened Bias,en,academic,citation;bias;heightened,,2024-05,2026-05-08,,original-research,no,
https://arxiv.org/html/2508.02740,arxiv.org,Who Gets Cited Gender Majority Bias LLM Reference,en,academic,citation;bias;gender,,2025-08,2026-05-08,,original-research,no,
https://arxiv.org/abs/2405.15739,arxiv.org,LLMs Reflect Human Citation Patterns abstract,en,academic,citation;bias,,2024-05,2026-05-08,,original-research,no,
https://thedigitalbloom.com/learn/google-ai-overviews-top-cited-domains-2025/,thedigitalbloom.com,Google AI Overviews 2025 Top Cited Domains Traffic Shifts,en,industry-blog,citations;domains;data,Digital Bloom,2025,2026-05-08,Klíčový top citation study,industry-leader,no,
https://www.stanventures.com/news/ahrefs-reveals-top-10-most-cited-domains-by-ai-assistants-3361/,stanventures.com,Ahrefs Reveals Top 10 Most Cited Domains AI Assistants,en,news,ahrefs;citations;data,Stan Ventures,2025,2026-05-08,,industry-leader,no,
https://trydecoding.com/blog/top-cited-domains-in-ai/,trydecoding.com,Top cited domains in AI 10M+ citations visibility,en,industry-blog,citations;data;decoding,Decoding,2025,2026-05-08,,practitioner-howto,no,
https://ahrefs.com/blog/top-10-most-cited-domains-ai-assistants/,ahrefs.com,10 Most Mentioned Domains ChatGPT Perplexity AIO 78.6M searches,en,industry-blog,citations;data;ahrefs,Ahrefs,2025,2026-05-08,Top citation study,industry-leader,no,
https://www.ultraseosolutions.com/top-100-most-cited-domains-in-google-ai-mode-ranked/,ultraseosolutions.com,Top 100 Most Cited Domains in Google AI Mode,en,industry-blog,citations;ai-mode;data,Ultra SEO Solutions,2026,2026-05-08,,practitioner-howto,no,
https://www.searchenginejournal.com/bing-webmaster-tools-adds-ai-citation-performance-data/566874/,searchenginejournal.com,Bing Webmaster Adds AI Citation Performance Data,en,news,bing;citation,SEJ,2026,2026-05-08,,industry-leader,no,
https://www.tryprofound.com/blog/chatgpt-citation-sources,tryprofound.com,How ChatGPT sources the web,en,tool-vendor,profound;chatgpt;citations;data,Profound,2026,2026-05-08,Klíčová analýza,industry-leader,no,
