url,domain,title,language,category,topic_tags,author,published_date,last_checked,summary,authority_signal,paywall,notes
https://www.gsqi.com/marketing-blog/how-to-remove-content-and-links-from-google-ai-overviews/,gsqi.com,How to Remove Content from Google AIO - Glenn Gabe,en,individual,glenn-gabe;ai-overviews;opt-out,Glenn Gabe,2024,2026-05-08,Klíčový opt-out návod,industry-leader,no,
https://www.stanventures.com/blog/ai-overview-prevent-content/,stanventures.com,How to Keep Content Out of Google SGE AI Overviews,en,industry-blog,opt-out;ai-overviews,Stan Ventures,2025,2026-05-08,,practitioner-howto,no,
https://www.playwire.com/blog/how-to-block-google-ai-overview-from-using-your-content,playwire.com,How to Block Google AI Overview From Using Your Content,en,industry-blog,opt-out;ai-overviews,Playwire,2025,2026-05-08,,practitioner-howto,no,
https://www.clearscope.io/blog/nosnippet-stop-content-showing-in-ai-overviews,clearscope.io,Can You Stop Google From Showing Your Content in AI Overviews?,en,tool-vendor,opt-out;nosnippet;clearscope,Clearscope,2025,2026-05-08,,vendor-marketing,no,
https://emfluence.com/blog/data-nosnippet-html-attribute,emfluence.com,Data-NoSnippet HTML Attribute Guide,en,industry-blog,data-nosnippet;technical,emfluence,2025,2026-05-08,,practitioner-howto,no,
https://www.stanventures.com/blog/data-nosnippet-attribute-keeping-search-snippets-under-control/,stanventures.com,Data-Nosnippet Attribute Keeping Snippets Under Control,en,industry-blog,data-nosnippet,Stan Ventures,2025,2026-05-08,,practitioner-howto,no,
https://almcorp.com/blog/google-ai-overviews-publisher-opt-out-controls-2026/,almcorp.com,Google New Publisher Opt-Out Controls AI Overviews 2026,en,industry-blog,ai-overviews;opt-out,ALM Corp,2026,2026-05-08,,practitioner-howto,no,
